,tweet
728,wara wiri naik mrt pakai lyfewatch tapcash bni dari gelang sport itu kita tinggal tap dan keliling jakarta quickpose 
729, halo saya orang pinggiran jakarta tangerang selatan yg kerjanya di jakarta dan tiap hari naik transum di jakarta so i wrote about what i know karena saya tau bahwa transum di jakarta udah bagus tj krl mrt tp masih sangat banyak yg naik kendaraan pribadi 
730, cari rute paling jauh dan paling asik buat ke museum museum di jakarta misal ke museum nasional naik kereta terus naik mrt terus naik busway dari museum nasional ke museum museum yg lain naik city bus tour
731, naik sepeda atau becak aja bebas polusi udara jakarta tanpa moto mobil kereta mrt krl pesawat buang ke laut
732,naik mrt jakarta aja belom pernah ini udah naik mrt bangkok aja 
733,coba para pejabat yg ada di jakarta semuanya cobain naik transportasi umum memberikan contoh sekaligus ngerasain kualitas transportasi umum di jkt kayak gimana berangkat rapatnya naik tj mrt krl jgn naik mobil dinas dikawal polisi bulan deh cobain
734, rl gengs naik mrt jakarta pake kartu apa kartu e money biasa bisa tidak_sih atau ada kartu khusus 
735, tp di bekasi dari jaman pemerintahan sebelumnya udah ada transjakarta untuk ke jakarta kok walau cuma dari sumarecon dan harapan indah sisanya ya klo mau ke jakarta naik krl doain aja proyek mrt di bekasi segera selesai walau cuma stasiun
736,sehappy ituu akhirnya bs kembali nyetir di jakarta terlebih ada tol yang hanya km dr rumah kalau pas lg tanggal ganjil tinggal cus naik mrt yang juga terjangkau dr rumah yays 
737, ya tp bs jd sumber polusi dong gabs dipungkirin kl mereka jg salah satu penyebab kemacetan kenapa gamau krn angkutan umum di jakarta msh kurang memadai dr segi fasilitas kenapa pamer naik mrt krn bangga sm jakarta udh bs maju kedepan 
738,sedangkan di jakarta cukup tap kartu e money mau transjakarta mrt krl bahkan katanya bisa buat naik jaklingko angkot 
739, yaudah sih tinggal naik mrt atau transjkt gaada yg mesti dikagetin dan diheranin demi kebaikan bersama kasian udara jakarta udh kotor bgt an drpd kalian kena penyakit paru 
740,sering kepikiran bisa kerja diluar kota jakarta misalnya tiap hari pulang pergi ngantor naik mrt atau krl tapi masih takut buat mulainya atau langkah awal resign dikantor yg udah thn ngasih nafkah
741,harusnya jakarta eh lebih tepatnya indonesia deh yaa majuin transportasi kenapa kmrn jalan di singapore pake kendaraan umum bis dan mrt itu sangat amat nyaman loh bahkan jalan km aja gua jabanin yang biasanya di bekaseh gua ke alfamart aja naik motor
742, jakarta gw sih setuju banget kalo naik transportasi umum macam mrt busway yang penting tertib bang khususnya yg di wilayah dki jakarta ya semoga lrt cepat jadi juga biar the jak yang di luar wilayah dki jakarta bisa nikmatin juga 
743,lama lama tidak_seberapa bgt capeknya perintilan beli tiket turun tangga naik mrt busway dibandingin macetnya jakarta 
744, khusus gua yg kuliah antar provinsi jakarta banten akses ke kampus lebih nyaman naik motor kenapa pertama kalo naik mrt itu rutenya kudu naik kereta arah sudirman terus nyambung mrt arah lebak bulus terus nyambung lagi naik angkot ojol jurusan ciputat
745,naik mrt di jakarta setiap hari jadi mimpi jogja solo ada mrt 
746,enak nih naik sepeda keliling jakarta sekaligus meng integrasikan semua public transport mulai dari sepeda dari kemudian naik pt transjakarta lanjut krl mrt lrt saat 
747,coba untuk mengurangi polusi jakarta itu artes artes mobilnya tidak_usah banyak kalau suting dekat naik saja mrt lah lanjut tj kan bisaaaa
748,ya emang sih gue kalo ke kantor masih naik motor cuman kalau naik umum sama aja dari stasiun ke kantor sama aja jaraknya dari rumah ke kantor sebisa mungkin gue kalo ke arah jakarta pake transjak atau mrt pasti yang lain ngeluh ngeluh aja tapi kemana mana males naik umum 
749,ada tidak_si yg abis an mau jalan sm aku gitu keliling jakarta naik mrt bosen di rmh aaaa
750,di jakarta berasa jadi nyonya tidak_enak bet dah kemana harus dianter sopir gk boleh naik krl mrt bahkan ojol gk boleh kebacut 
751,mencoba naik mrt jakarta 
752,asap asep asap asep koentjinya adalah kesejahteraan tiap daerah tidak_merata perbandingan gaji di jakarta sama di daerah anjlok bgt udahan yuk naik mobilnya ke kantor kalo cuma sendirian doang mah public transport udah banyak pilihan krl mrt busway ojol bisa koook
753, wkwkwk iyaa dipanggil elder orangnya ramah tanya udah lama di jakarta pernah naik mrt nanti turun di mana gitu bahkan gerejanya di sebelah smaku wkwkwk
754, rmm dirut tj dan mrt naek angkutan umum kok yang tj naek mrt jakarta satunya naek kci dulu mungkin sekarang naik mrt juga 
755,yuk naik mrt jakarta dan jngn lupa simpan single trip ticket juga struk pembelian tiketmu trn di stasiun cipete raya mampir ke outlet nasi jeruk tanggal tua dan dapatkan gratis kopi lima detik untuk setiap pembelian menu njtt periode promo hingga agustus 
756, bahkan sekali pun naik mrt jakarta belum_pernah 
757,naik mrt jam segini ngeliat muka penumpangnya capek semua hft jakarta sekeras ini yaah 
758,biar kekinian kayak anak anak jakarta bodjo juga gakmau ketinggalan buat nyobaik naik mrt jakarta nih tapi kali ini seru banget karna sambil nyanyi nyanyi wohooo nonton selengkapnya disini 
759,pgen naik mrt lagi tpi jakarta timur tidak_ad mrt huhuhu trpaksa naik grap dri halim ke balai sarbini 
760,udara di dki jakarta buruk kata jk beralih ke transportasi umum pak brt itu bahan bakarnya diesel biodiesel brt nyebarin polusi udara keliling jakarta jam non stop mrt rute sedikit sementara yang biasa naik kendaraan pribadi adalah commuter 
761, tidak_kantorku khan jakarta timur tidak_dilewati mrt atau lrt paling deket ke stasiun pasar minggu aku udah nyobain semua masih sepi dan bukan pilihan alternatif karena biayanya mahal p aku naik busway ke blok m naik mrt 
762,ngelihat jakarta yg gini bgt grey sky nya jd inget a beautiful jogja sky and its merapi during my years before skrg kalo ke arah area ber mrt langsung maunya naik mrt instead of car 
763, kl di jakarta aku jalan jalan di jalan protokol dr sarinah ke hi trys naik mrt ke senayan jalan jalan deh ke sanaehehe
764,hari ini pertama kali naik busway mrt dan goride di jakarta mamah anakmu bangga sekali
765, kalo bego jangn dipiara cong bikin msikin aja mending piara sapi or kambing jadi duit cong apalagi lebaran haji harga naik cong bisa buat piknik ke jakarta naik mrt lo mesti belum_pernah naik mrt kan ckfkxkxk
766,ini tidak_ada yg mau ajak aku ke jakarta apa ya ku ingin naik mrt 
767,yah pak warga jakarta bejibun yg naik kendaraan pribadi msh byk bgt pak asli deh pak daerah selatan msh macet meski udah ada mrt ama transjakarta busway 
768,ini adalah banyaknya orang yang menggunakan mrt jakarta pas hut jakarta ke bayangin aja ada segitu banyak orang yang berkontribusi untuk naik moda transportasi umum demi jakarta yang lebih lengang mantap 
769,wisatawan aja naik mrt lrt dan jakarta city tour di jakarta sambil nikmatin nuansa kota tua bareng yg tercinta dan tersayang bagian 
770,abis muterin jakarta naik turun mrt sampe dibilang bau matahari y thx ibu
771,wisatawan aja naik mrt lrt dan jakarta city tour di jakarta sambil nikmatin nuansa kota tua bareng yg tercinta dan tersayang bagian 
772, depok jakarta motor bensin ron rb bisa buat minimal hari pp kombinasi ojol krl mrt sekitar rb hari pp dengan waktu tempuh perjalanan x lipat lebih cape naik motor tapi ini ngomongin ekonomis kan hehe
773,pengen ngablu sendirian keliling jakarta eeh lupa bawa flash kan susyah kalau kudu ngantri dulu mau naik mrt
774,polusinya makin aja jakarta ayolah apda naik mrt apa tidak_busway apa tidak_transportasi umum naikiin gojek atau ojek pengkolan gausa bawa mobil sendiri atau motor sendiri laa kasian anak anak kecil kasian yang punya asma atau gangguan lainnya 
775, selama penduduk jakarta tidak_gengsi untuk naik kendaraan umum dan pemerintah intensif untuk terus mengembangkan tj krl mrt lrt dsb pasti polusi bisa ditekan
776,anak jakarta lgi hemat life naik pesawat naik grab ribu tapi sejam nyampe atau ribu ka bandara ribu mrt ribu grab senayan kos tapi ditempuh jam 
777,ternyata eskalator mrt jakarta disetel naik vs turun sesuai jam ngantor dg asumsi selatan adalah tujuan massa saat jam pulang kantor lah hamba ini jadinya kudu meniti naik anak tangga alon alon kelakon wae krn eskalator di st layang cipete disetel turun 
778,kurang afdol rasanya kalo sudah sampai ibu kota tidak_naik mrt dan ke bundaran hi ingin merasakan macetnya jakarta bundaran hi jakarta 
779, hari yg lalu norak bgt naik mrt thanks untuk teman ku billah dan elita yg telah mewujudkan mimpi naik mrt maaf ku telat menikamti fasilitas di jakarta
780,kemarin seharian keliling jakarta menggunakan transportasi umum naik krl kemudian mrt diselipkan ojek online di tengahnya bila perlu rasanya waktu bepergian lebih bisa diprediksi ketimbang membawa mobil sendiri 
781,rindu mengelilingi jakarta depok bogor naik kereta mrt busway hoho berasa dipedalaman
782,cita cita naik mrt jakarta 
783, era pak anies mmg banyak dilakukan integrasi antar moda angkutan ini sesuatu hal yg sgt penting yg tinggal di bintaro bsd dijemput royal trans untuk naik mrt ke jakarta pusat 
784, jalan sama adek sama sepupu naik mrt trans jakarta gitu itu lagi di stasiun jakarta kota w
785, ayo main jakarta ntar naik mrt sampe mabok
786, saia th tinggal di jakarta belom pernah naik mrt dong 
787,teka teki teka teko kenapa penumpang di bawah usia yang naik mrt trans jakarta commuter line yang duduk hampir tertidur a abis siskamling b abis lembur c baru punya baby jadi begadang mulu d ngarab sugab e lainnya silahkan isi trims
788,bm ke jakarta dan naik mrt 
789,naik mrt di negara orang pede aja giliran naik mrt di jakarta buat pertama kali canggung 
790,ini dia peta rute mrt jakarta masa depan pembangunan mrt jakarta hingga ditargetkan mencapai km terdiri dari km jalur bawah tanah dan km jalur layang tidak_sabar pengen nyobain keliling jakarta naik mrt 
791, jasa sewa pacarnya bu bisa diajak muter jakarta naik tj mrt angkot bajaj sesuka ibu aja mau kencan model kek mana bisa bu di order
792,jadi cerita dulu aku dari jakarta timur naik gojek ke jakarta pusat karna aku belom tau rutenya wkwkwk terus aku berhenti di stasiun mrt bundaran hi disebrangnya ada halte busway transjakarta tepatnya disebelah utara bundaran hi
793, gue tinggal di jakarta tapi tidak_pernah naik mrt 
794,weekend tiba saatnya liburan buat kamu yang ingin jalan jalan dengan naik mrt tapi bingung mau kemana ini dia beberapa rekomendasi tempat wisata sekitar jakarta yang bisa kamu jangkau dengan menggunakan mrt 
795,udah ky di ln nih jakarta ngantor naik mrt dr stasiun jalan kaki mantaap
796,pernah nonton youtube jalan jalan keluar negeri yang mereka kemanapun mudah karena naik transportasi publik 
797, ya sok cepet beresin skripsinya nanti main ke jakarta aku ajak naik mrt haha 
798,sungguh salut buat yg kerja di jabodetabek tp pulang dan perginya naik angkutan umum re krl busway mrt apa pun lah apalagi yg rumahnya di ujung dunia bekasi kerjanya di belahan barat jakarta ya pokoknya yg ujung ke ujung kalian super sekali 
799,mikir di jakarta apa cuma aku yg belom naik mrt duh aku tidak_gaul 
800, penumpang naik mrt jakarta per hari pasca bulan beroperasi 
801, naik krl jurusan jakarta kota turun di st manggarai trus transit kereta yang arah sudirman angke duri jatinegara trus turun di st sudirman jalan kaki dikit trus naik mrt dukuh atas naik jurusan lebak bulus grab trus turun di blok m 
802, iya kannn aduh macetnya ampun an deh jakarta alhamdulillah ada mrt hehe 
803,a lot more people taking mrt for going to kondangan looks promising jakarta 
804, ambu an ke jakarta kan nanti naik mrt 
805, batik nusantara akan bawa misi perdamaian dunia bertempat di stasiun mrt bundaran hi jakarta kamis agustus presiden ri joko widodo untuk pertama kalinya menorehankan 
806,kawasan kota tua salah satu objek wisata favorit di jakarta mau ke sini gampang banget bisa memanfaatkan layanan krl commuter line atau transjakarta bisa juga menggunakan mrt turun di bundaran hi tapi lanjut lagi pakai transjakarta happy 
807,ya udah lama tidak_naik transportasi umu jakarta sepertinya memang lebih baik armada pengangkutnya tj baru mrt krl masi mbleber sih dan belom pernah naek lagi 
808, beresin kemacetan jakarta lebih mudah dilakukan koordinasi kalau gubernurnya mampu tidak_seperti gubernur yg sekarang selain itu perlu dicamkan jokowi memutuskan pembangunan mrt sewaktu masih jd gubernur sebagai solusi nyata mengurangi kemacetan gmn dgn wan abud nol 
809,yang perlu teman ketahui sebelum naik 
810, abi mrt jakarta adalah sejarah panjang mulai digagas tahun dan diselesaikan di era anies btw ahoknya dmn ya 
811, iya tp concerns publik pasti di jakarta dan juga sbnrnya peminat krl itu banyak bgt selain peran pemerintah nyediain transport public harusnya pemerintah jg harus menjamin keamanannya juga naik bus kurang menjamin tp murah mrt tarif tidak_mendukung
812,aku ni drdl gaberimpian di jkt krn dr kecil br keluar rmh tante udh macet lingkungan tidak_sehat tp ak yg drdlu berimpian kesana kemari naik commuter kereta jalan kek di jepang dn luar negri baru jakarta di indo yg sejauh ini fasilitas transportnya sesuai sama aku krl mrt 
813,sabtu sore gini di jakarta enaknya ngapain ya a jalan dan kuliner di mall b naik gunung ke bogor c keliling jakarta pake mrt 
814, pft gini aja kagak nyambung baru keluar dari goa gw kemana kalo di jakarta kalo tidak_krl transjakarta dan sekarang ada mrt udah enak banget kemana pake itu kalo lagi males jalan ke halte dan stasiun naik ojek dl 
815, bikin kereta cepat jakarta bandung biar cepat ke jakarta pas jadi ibukotanya udah di pindah investasi lrt mrt jalan tol layang yang pasti puluhan tahun balik modal itu buat apa semua kalau ibukotanya sepi dodol kan 
816, bagaimana kalau mulai membangun mrt antar jakarta dgn botabek jg 
817,radar bogor jakarta diguncang gempa mrt sempat berhenti lalu normal kembali jakarta radar b 
818,jakarta diguncang gempa mrt sempat berhenti lalu normal kembali 
819,saya jakarta mau pindah ya lu iya bang saya knpa lu macet dan lain lah saya wah nanti yang menikmati orang asing lah ya seperti mrt dan lain yang sedang di bangun
820, pasca gempa banten mrt cek infrastruktur jalur bawah tanah pt mrt jakarta melak 
821, gempa jumat malam sempat hentikan layanan mrt jakarta 
822,jadi semalem ada yg nitip review ke gue clay hotel jakarta deket sama st sudirman dan mrt sudirman jd gampang lah ya masih kejangkau sama kendaraan umum juga soalnya ink hoteknya dr luar agak kecil dan parkirannya sempit 
823, jakarta gunakan transportasi publik trans jkt mrt krl stop nyebat dulu di stadion kurangi penggunaan plastik straw botol plastik bawa wadah minum sendiri dari rumah dan mau masuk stadion biar tidak_nuangin aer ke plastik pas otw stadion gausah maenan rf smoke bomb
824, trafi mbak dia udah kerjasama sama transjakarta jadi kita bisa selalu tau lokasi bus sedang di mana krl mrt jaklingko angkot luar jakarta tangerang bekasi bogor bus biasa semua ada di app nya jadi sangat membantu 
825,jangan sampe ada yang kena tsunami deh apalagi jakarta blom pernah naek mrt soalnya ke comedymarkette apalagi
826,operasional dihentikan smtra gegara gempa stasiun mrt blok m in jakarta selatan dki jakarta 
827, mrt lagi lewat itu btw lu jakarta mana san 
828,jakarta gempa sekitar stasiun mrt cipete raya goyang kirain efek keretanya lewat ternyata gempa 
829, pak saya setuju tapi apakah kapasitas angkutan umum kita mampu monggo cek krl bogor ke jakarta lrt bekasi belum_siap kalo mrt terbatas lokasi tertentu takutnya jadi back fire saya lebih khawatir nanti tidak_efektif bukan pesimis tapi coba realistis
830,ya mau gimana lagi angkutan umum ya masih belum_ada kemajuan signifikan transjakarta mrt krl yang desek desekan banget di jam pulang kantor masih sangat kurang apalagi buat masuk ke daerah daerah pelosok jakarta masih kacau bet angkotnya 
831, jakarta kalo naek krl dan tj okelah murah tapi kalo mrt orang juga mikir mending naek kendaraan pribadi nder
832, tidak_ada bukti bahwa premanisme selesai di jaman pak jokowi itu klaim anda sendiri lrt dan mrt bukan masalah di jakarta yang jadi masalah di jakarta itu macet banjir kemiskinan anda sedang halu dengan segala bayangan yang anda buat sendiri dicekoki media massa partisan 
833,dengan public transportations sekomplet jakarta ada ojek taksi daring tj mrt harusnya bawa mobil sendiri malah merepotkan yet why people untel untelan di jalanan krn pd ribut bawa mobil dhewe 
834, buat kota se sibuk jakarta mrt pasti perlu lah wajib masalahnya pembangunannya aja dah salah rumah sederhana letaknya di pinggir kerjanya ke sini jd ya mobil bakal laku aja dari dulu selalu begitu
835,misalnya orang orang dah pada tidak_pake kendaraan pribadi pun gue tidak_yakin tj angkot kereta komuter mrt lrt bus bisa menjangkau semua daerah di jakarta kalo orang disuruh jalan kaki dari pemberhentian transportasi umumnya juga trotoar kaga semua ada di jakarta begimana
836,jakarta itu enak buat dipake b w kalau transportasi publiknya bener dan minim polusi jalanan relatif datar ada krl mrt yang bisa dipake kalau tujuan agak jauh sisanya gowes paling kilo ttd cah pesepeda anyaran
837, justru kamu itu di pilih warga jakarta biar lebih baik dari pemimpin yang dulu kok malah lebih buruk peninggalan gubernur sebelum kamu yang baik baik kenapa yang dapat nama kamu seperti mrt lrt lingkar semanggi dan banyak lagi kalau kamu apa yang ada 
838,saking stabilnya mrt jakarta ada yang lagi pasang maskara lho emang tidak_ada kok larangan make up an di mrt 
839,he he he itu yg betul bukan malah menyalahkan bang anies klu tingkat polusi di jakarta semakin meningkat ttp krn pembangunan infra struktur mrt yg banyak memangkas dan menebang pohon penghijauan yg merupakan filter polusi di wilayah jabodetabek pikir ye bong 
840,jakarta nyaman gue tidak_akan bawa mobil lagi fixxx apalagi kalo mrt yg nyampe ke bekasi udh jadi beuhhh 
841,besok ke jakarta buat short escape wkwkwk ada apakah yang baru di jakarta selain mrt dan lrt let me know
842, jakarta sebanyak taruna i d iv manajemen keselamatan transportasi jalan angkatan vii melaksanakan kegiatan kunjungan ke mrt ppli dan pt elnusa petrofin kegiatan ini bertujuan agar taruna i 
843, bangun jakarta taun ke depan om di beritanya ada program strategis kayak mrt lrt kereta cepat bandung jakarta dsb dsb jika ibukota pindah apa kebayar utangnya 
844,cashless in jakarta be lyke bayar transjak mrt pake flazz bayar gojek pake gopay ngopi pake debit tidak_ada minimal bahkan jajan bakso di emperan blok m bisa pake gopay dpt cashback pula 
845,jakarta ini gede knp w mesti ketemu mantan d mrt siiii 
846,kenapa di jakarta masih tetep macet ya padahal busway banyak banget mrt udah ada kereta juga ada kayak tidak_ada bedanya gitu macetnyaaa 
847,mau mengandalkan mrt jakarta sebagai sarana transportasi kamu bekerja simak dulu plus dan minusnya dalam ulasan berikut 
848,di bulan kemerdekaan indonesia agustus ini presiden joko widodo dan ibu negara iriana joko widodo membatik dalam kegiatan goresan batik kemerdekaan yang digelar di mrt bundaran hi jakarta kamis pagi kemarin tv 
849,from presiden joko widodo didampingi ibu negara iriana joko widodo menghadiri acara goresan batik kemerdekaan di beranda peron a stasiun moda raya terpadu mrt bundaran hotel indonesia jakarta kamis 
850, sekedar memgingatkan cak sebaiknya mulai sekarang warga jakarta jangan pakai mobil pribadi pakailah mrt utk transportasi 
851,presiden dan ibu negara iriana membatik dalam acara pameran batik di stasiun mrt jakarta jelang peringatan hut ri ke 
852, coba dicek aja tingkat polusi kota jakarta antara tahun apakah kota jakarta termasuk kota tertinggi tingkat polusinya di dunia karena diperiode tsb infrastruktur lrt mrt lingkar semanggi tol jorr berbarengan dikerjakan 
853, bikin kebijakan sadis mobil motor pribadi dilarang masuk jakarta kerja di jakarta harus ktp domisili jakarta pembangunan lrt mrt di tol cikampek bubarin bikin macet dan polusi mewek mewek tuh cebong 
854,mrt jakarta pls buatin kek gini 
855, jakarta belum_jadi juara dunia kategori polusi udara yang di lakukan jokowi dan ahok membuat aturan dan proyek penunjang transportasi umum yang berhubungan dengan transjakarta mrt lrt kalo anies baswedan melakukan upaya apa 
856,kasian cowok selalu salah didepan cewek kasian orang jakarta udah bikin mrt lrt ganjil genap tetep aja salah dan polusi naik kasian pak anies ada yang lebih buruk tp tetep aja yang disalahin dia kamu cowok orang jakarta dan jd pak anies wkwk kelar dah 
857, kalo nanti jadi ri pasti banyak nyalahin jokowi soalnya jokowi udah bikin toll ribuan kilometer bikin bendungan bikin jalan trans papua lrt mrt kereta cepat jakarta bandung bikin pelabuhan laut dan bandara bikin kapal ikan asing lari mcm pokoke
858, oke namun menjadikan artikel tersebut menjadi acuan itu kurang tepat mengingat transportasi di jakarta itu hanya mrt ada angkot jak lingko dan transjakarta harga yang diberikan mrt itu sudah pas apalagi daerah yang dilayani memang business center 
859, menit meter dari stasiun mrt jakarta 
860,mumpung di jakarta pengen nyobain mrt tapi sendirian gini nanti kalo nyasar aku masuk tv terus jadi terkenal kan repot 
861, bukan saya mas up to percent itu gambaran masy jakarta data bank dunia juga kalau ndak salah mendekati persen 
862,masalah transportasi umum di jakarta yang utama itu reliability waktu kaga ada yg ontime bgst kecuali mrt
863, terserah sih mau malem ini lagi bantu ngurangin polusi di jakarta tidak_bawa kendaraan pribadi ke kantor dari mrt nyambung transjakarta eh malah suruh muter buat naik bus nya kak 
864, coba bljr kemana mana pakai transportasi umum karena jakarta bnyk polusi nya gara kendaraan selain mengurangin polusi juga mengurangi kemacetan apalagi skrng busway udah bnyk rute nya trs ditambah mrt yakan kita udah dikasih fasilitas sama negara gunanya untuk itu 
865, makanya ku berharap pemerintah langsung menerapkan ganjil genap satu jakarta deh karena semakin buruk udara takutnya yang biasanya pake trans mrt malah jadi pada takut dan memilih bawa mobil sendiri 
866, trima pak jokowi dan ahok krn klian jkt pnya mrt lrt simpang susun semanggi sklh diperbaiki jadi baik rusun jd bgs rptra di sudut ibukota jd pntslah kmudian dpt pghargaan di bid infrastruktur skrg tgl dorong pak anies realisasi std jakarta mrt fase ii dan lrt fase ii
867,jr jabodetabek residence ini shuttle untuk tujuan ke beberapa titik di jakarta bisanya kawasan sudirman atau yg di lewatin mrt tp jr serpong ini khusus buat tujuan mrt lebak bulus jangan sedih tarifnya cm 
868,tiap ada orang yang bilang mau ke jakarta gw selalu bilang gw pengen naik mrt 
869, polusi salah anies sampah salah anies macet salah anies pas ada keberhasilan seperti mrt dan lrt di jakarta ditambah kesuksesan asian games langsung diklaim keberhasilan jokowi 
870,mas mas suka ngangkot nyobain mrt 
871,gua kesel banget sumpah sama orang yg soktau soal kota gua lu kira palembang mah dusun kagak tau aja lu sepanas semacet semriwet apa palembang sekarang btw lrt palembang jg operasiny lebih duluan daripada mrt jakarta masih mo bilang emang enak tinggal di sumatera 
872, lee mana tau si bobby mo nyobain mrt jakarta ato jgnjgn mo cod baso aci kali dia kan bisa jadi
873, di stasiun mrt jakarta nih 
874,ya emang sih resiko biasanya yang ngomong begini banyakan nyalahin pemerintah tidak_mau gerak jakarta yang salah manusianya buat apa ada mrt lrt kereta tije dll tapi masih pamer kendaraan you should have a good solution not just critize w o act 
875, di mrt haji nawi mas maaf tidak_bisa shalat disini air lagi tidak_ada mas dipake damkar buat kebakaran yg di fatmawati duh mas toilet juga tidak_ada kebelet asli ini iya mas sama masalah jakarta darurat air juga ya 
876, hihihi ngaku location di jakarta tapi tidak_tau kalo jpo dpn arthaloka udah dibenerin emg apa yg salah sih kalo pemimpin itu program pmimpin sblmnya jokowi lanjutin proyek mrt yg udah dirancang fauzi bowo gue diam aja janin kodok trgila dg persaingan pantas beringas 
877,fatmawati one hotel residence apartemen eksklusif selangkah dari stasiun mrt cipete raya jakarta selatan ikuti radio talk bersama ratdi gunawan marketing consultant fatmawati one hotel residence kamis pukul wib 
878, lebih hemat dan mudah memindahkan gubernurnya saja daripada memindahkan perangkat abdi negaranya lagipula jakarta kan infrastrukturnya sudah lengkap dan sebentar lagi jika mrt lrt dan pembangunan infrastruktur transportasi lainnya sudah selesai jakarta tidak_akan macet lagi 
879,ibu kota pindah nasib jakarta gimana jakarta bakal tambah maju brooo udah ada mrt udah ada tol dalam kota busway dsb malah bagus ibukota dipindain jd gk sumpek dan fokus jd kota bisnis justru jd pr berat untuk ibukota berikutnua
880, bagaimanapun itu gubernur jakarta terbaik baru setahun menjabat bisa sukses selenggarakan asian games belum_tahun bisa menyelesaikan mrt bila buruk tentu pendukung beliau yaitu yang berisik terlebih dahulu 
881,kalau kualitas udara jakarta sudah jelek kenapa macet tetap parah cuek pakai kendaraan pribadi ya apakah warga jakarta memang ignorant sudah ada mrt busway mungkin yg ini memang masih belom nyaman tapi klo jarak dekat ya pada jalan kaki lah 
882, google jkt anies baru menjabat bulan oktober bbrp bulan menjabat jakarta mendapat penghargaan itu tentu hasil prestasi gub sebelumnya lalu bgmn skrg jakarta kota paling berpolusi kalo tidak_diselesaikan mungkin begitu jg penghargaan perbaikan transportasi dgn adanya mrt lrt
883, jenius tidak_bisa bayar mrt jakarta tragis ya tidak_
884, maha hebat anies dengan tahunnya dapat penghargaan mrt lrt selesai sungai bersih jakarta bersih dari sampah jakarta sesegar udara puncak ok oce meningkatkan taraf hidup sobat misqueen dp buat penduduk misqueen next pulau reklamasi selesai 
