,tweet
383, kalopun antusias gakan cukup mrt kereta busway menampung seluruh warga kalo bener gada yg naik motor menurut gue intinya angkutan umum di jakarta msh kurang memadai contohnya busway msh ada yg tumpah ruah di jalan jg make jalan umum jakarta belum_sesiap harapan 
384,didn t expect the mrt gonna be that nice berasa tidak_di jakarta 
385, besok udah mulai cuyy jadi pengen ngistora lagi buat yg pertama kali ke jakarta dan ngistora sendiri tidak_usah takut nyasar soalnya sekarang udah ada mrt yg langsung ke istora 
386,anggota mpr ri dari fraksi nasdem syarief abdullah alkadrie mengapresiasi pertemuan antara presiden joko widodo dan prabowo subianto di stasiun mrt lebak bulus jakarta sabtu 
387, ituu dia pemerintah jakarta belum_bisa memberikan trust terkait transportasi umum but kereta mrt itu udah cuku better banget sih kalau soal kendaraan sih ya gw kurang tau menau keknya itu segitu jumlah kendaraan pemilik aja deh tidak_dipake semua segitu dijakarta
388, wahhhh jadi beneran jakarta udah kembali ke masa saya masih bujang nih padahal pas dua thn lalu kesana udah lumayan loh malah sempat nonton jalur mrt yg blm jadi 
389,terimakasih pak dan semua pihak yang terlibat dalam mrt setidaknya bisa merasakan sedikit singapura di jakarta 
390, saat ini mrt jakarta hanya melayani rute dari lebak bulus bundaran hi 
391,jam tiga kamu masih bilang iloveyou mas jam lima udah mutusin aja emang bener sih perasaan bisa berubah tapi tidak_sekilat gitu juga kali udah kayak mrt jakarta aja 
392, teruntuk sender yang kerja di jakarta itu bukan cuma yang tinggal dijakarta loh tapi dari jabodetabek juga lo nyalahin pemerintah kan udah disediain kereta mrt lrt busway itu salah satu buat mengurangi polusi juga btw dan kanker paru paru disebabin bukan karena polusi aja
393,beberapa lokasi di jakarta terutama di kawasan jalan sudirman thamren medan merdeka menawarkan keindahan ibukota memang tidak_semuanya tentu ini masih berkaitan dengan mrt yang menjadi bagian infrastruktur ibukota 
394, perasaan kendaraan umum di jakarta kaya tj krl mrt murah deh
395, dia naik apa btw gue keliling jakarta naik busway naik krl naik mrt belasan ribu ini kawasan suburb dimana pinggir jakarta bahkan daerah ui pun udah ada busway yg kecil itu tidak_masuk akal dia bilang mahal dia naik apa btw 
396, eh tpi karna aku tidak_punya kendaraan pribadi di jakarta jadi naiknya kendaraan online mrt atau busway 
397, pemerintah sdh mengeluarkan semua usaha krl tj mrt tapi kembali lg ke kondisi negara penduduk jakarta sendiri padat banget kamu pikir berapa banyak orang yg sudah beralih ke transport di atas tapi kembali ke mobil pribadi saking padatnya kamu tidak_bisa nyalahin siapa siapa
398, wkwkw kamu warga jakarta atau baru jadi warga jakarta o kok aku suka suka aja ya naik busway naik mrt naik krl o mau jauh pun suka suka aja aku
399,aku bukan orang jakarta cuma beberapa kali pernah main ke jakarta tapi mau nanya apa emang krl mrt busway selalu sepenuh itukah sampe pada lebih milih pake kendaraan pribadi padahal aku waktu itu naik busway sama krl jauh lebih cepet sih dibanding pake pribadi ojol 
400,berkat org teroris masup jakarta akhirnya bisa menjadi eo ketemunya sexy killer di mrt wkwkkwkwk
401,assalamualaikum twitter users sebagai postan perdana saya ingin foto pertama kali saya menggunakan mrt jakarta 
402, yowis ke jakarta aja mas trus nyoba mrt lrt sekalian 
403,mrt siapkan lahan parkir berkapasitas mobil 
404, di mana mrt di asteng juga di banyak stasiun ada atm bisa berderet beberapa jakarta lengkapin lah segera 
405,selalu takjub setiap naik mrt karena masih tidak_nyangka jakarta udah seberkembang ini dalam rentang waktu kurang lebih tahun selanjutnya akan seperti apa ya surprise me jakarta 
406, naik mrt beberapa hari yang lalu sampe kawasan mrt cipete fatmawati ngeliat kok jakarta sanaan dikit berkabut ya etaunya polusi tebal banget kayak bulket 
407,stasiun mrt jakarta telah memiliki lebih banyak area parkir 
408,first time naik mrt bener bersih banget dingin bgt disetiap stasiun petugas nya ramah fasilitasnya memadai dan yg pasti keren jakarta tidak_kalah keren pokoknya punya mrt seperti di negara luar sana mantap 
409,call me norak or whatsoever but i m really amazed with jakarta mrt pertama kali jd lgsg ngejudge ih kenapasi tidak_teratur pas liat antusiasme masyarakat thdp transportasi umum yg baru ada di jkt ini ternyata makin kesini makin rapih bersih semua butuh penyesuaian 
410, seharusnya di setiap stasiun mrt jakarta ada mesin atm supaya pengguna kartu bank bisa isi ulang atau melakukan transaksi lainnya ini standar yg ada stasiun mrt di seluruh dunia 
411,pengen deh bisa bantu ngurangin polusi di jakarta ini pengen kemana mana naik angkutan umum aja cobain kali ya besok naik migo mrt seharian 
412,btw mrt jakarta bagus jg eh g kalah ma yg d korea wkwkwkwk
413, semoga jakarta ini tidak_macet lg apalagi udh ada mrt dan krl juga lg dibangun lrt semoga warga jakarta bisa memanfaatkan transportasi umum yg udh disediakan pemerintah 
414, haduh hebat orang palembang udah nyobain mrt di jakarta tidak_kayak saya
415,perdana naik mrt di jakarta bangga banget bisa sebagus dan serapih itu jakarta rasa luar negeri terima kasih ya pak btp 
416,oh iya bts sama mrt itu dua entitas berbeda yang bahkan pembayarannya tidak_bisa dengan satu kartu yang sama untuk ini jakarta masih lebih unggul thanks to jak lingko aka bni tapcash 
417, emang bener kok nder lagian pilihan transportasi umum di jakarta kan banyak ya dan mnurut gua udh bagus dan nyaman sih contohnya tj atau mrt gt cuman pasti pada gengsi aja buat naik kendaraan umum
418,wagelase jakarta menyenangkan sekali transportasi umumnya dari kosan ke mayestik pp naik mrt babang grab gojek promo rb rupiah saja tapi tapi bawa bahan total meter capek giwlaaaa
419,cobain naik mrt ke blok m tinggal cobain lrt keren jakarta ku 
420,menjelang sore setelah ratusan purnama terlewati akhirnya kesampaian juga menjajal moda transportasi umum paling hits di ibukota inilah dia jakarta mass rapid transit mrt mampir di stasiun fatmawati stasiun favoritnya 
421,yuk perkaya lagi jakarta dengan karya karya seni seperti mutal di tunnel stasiun mrt dukuh atas dan mari kita jaga bersama kebersihan dan keamanan hayo semangat jajaran 
422, mirisnya lg byk cebong tolol yg komen malu jakarta dpt predikat kota berpolusi terparah justru itu umpannya nantinya anies akan ditanya bgmn solusinya mengatasi itu gayung pun bersambut dan cebong pun merasa keren naik mrt 
423, silakan naik mrt jakarta ke arah bundaran hi dan turun di stasiun dukuh atas bni kemudian bisa dilanjutkan dengan naik ka bandara untuk menuju bandara soetta terima kasih 
424,mrt jakarta raup pendapatan rp miliar pt mrt jakarta mengantongi persen dari target pendapatan sebesar rp miliar di sepanjang tahun ini pendapatan yang diperoleh berasal dari penjualan tiket hitung punya hitung 
425, nyobain moda transportasi baru di majalengka majalengka 
426, saya warga jakarta saya tau banget mrt tapi saya juga belum_pernah naik mrt saya tidak_tau apakah saya harus bersedih atau bersahaja sungguh saya tidak_tau kalok mas sendiri bagaimana 
427,mrt jakarta evaluasi stasiun yang masih sepi penumpang 
428,rt dikandika kaesangp ayo mas nanti di pandu dri st bundaran hi st lebak bulus mrt jakarta sekarang lagi ngadain event 
429,yah maap aku maunya kuliah di depok bukan di jakarta biar hemat ongkos bs naik ojol maupun angkot angkot hanya tigaribu kalo jakarta riweh mana naik mrt he
430,o i a talk about my last visit to jakarta random aja kmrn wkt abis dr pi papasan face to face gt sm s v a az z h gt di escalator menuju mrt she looked so keren irl hhu pgn bgt pdhl tanya dia tolong ajarin w hijaban ky gt donk tp krn w bukan sasaeng jd w diem aja 
431,di kedua medsos mrt jakarta sama sekali tidak_ada postingan tentang peristiwa menghebohkan kemarin paling jawabannya maaf kak kami netral yaelah itu udah paling netral kali peristiwanya 
432,mrt jakarta menyebut lahan park and ride yang kini dioperasikan masih bersifat sementara dan sedang disiapkan untuk fasilitas permanen 
433, serasa spt di ln kt pa prabowo bersama pa jokowi sebelumnya btp pun bilang mrt jakarta lebih bagus dari ln 
434,pak btw btw bwt berkat mrt kini kalau ada teman datang dari luar jakarta sudah tidak_pusing lagi mau ajak kemana tinggal ajakin naik mrt hehe 
435,waaa akhirnya naik mrt jakarta bagus bgt kaco tidak_nyangka indonesia bisa punya beginian 
436,naik pakai e money dari lebih mudah sekarang 
437,dapet kembalian nya dolar semuaaa untung sukaaa naik 
438,lope banget kantor di jakarta kota ujung mau naik tije dan krl masih kosong transit nya gampang sejalur lg sama mrt ah lope
439,naik angkutan umum di jakarta so cozy tidak_mau turun lagi kalau udah di dalem krl mrt busway transjakarta 
440,jadi tadi naik mrt trus turun di senayan fyi jarang banget bisa jalan di trotoar jakarta dan noraknya gue bagus banget jakarta ternyata kalo rapih begini mrtnya juga keren banget geng sampe pengen naik lagi semoga sampe seterusnya mrt bisa rapih dan sebagus ini
441,dear tolong dong buat stasiun istora mandiri exit bei disediain eskalator segera kasian liat orang tua pada capek naik tangga trimakasii
442, lift prioritas di sta istora ini sdh mati beberapa hari apakah tidak_ada tindakan perbaikan kasian bumil disuruh naik tangga 
443, saya klo naik mrt dari lebak bulus motor saya kudu taro di alfamart depan tangga saran saya buatlah kantong parkir yang dekat jaraknya dan layak klo hujan naik ke mrt tidak_kuyup kenapa tidak_pasang atap sepanjang jalan poins square menuju mrt yaa 
444,ga nyaman skr naik security trutama pd rese udh ada metal detector ngapain pake priksa tas bikin keamanan bukan gitu caranya
445,tarif mah tidak_masalah kalau liat kualitas tapi tidak_ada park n ride di setiap stasiun kalau naik transportasi umum lain ke stasiun waktu jadi lebih lama mudah mudahan akan tersedia park n ride minimal untuk motor di tiap stasiun
446,kemarin naik mrt dari istora ke blok m lanjut naik busway turun lppi kemang gitu aja aku terharu loh jakarta udah mudah aksesnya
447,tadi pagi saya naik penumpangnya mulai berkurang saran saya banyak kerjasama dengan transjakarta agar ada diskon atau paket khusus dengan mrt sehingga menekan biaya transport
448,masih jaman naik motor gunain dong transportasi umum bersih santay anjay mantay terimakasih mrt
449,kenapa ya beberapa kali naik bauknya pesing 
450,min lapor pagi ini halte mandiri istora exit bej lift mati dan tidak_ada eskalator ada ibu yg terpaksa naik tangga karena jauh lagi kalo berputar lewat exit pmj dan sampai atas sangat terengah mohon perhatian fasilitasnya 
451,jakarta bisa berubah kok dengan kita masyarakatnya jg berubah gue lihat sh sepanjang naik mrt gk ada yg aneh kayak naik krl atau tj ya dan mnrt gue jakarta yg lebih ramah bagi pengguna angkutan umum itu akan terwujud pasti 
452,iyaaa wkwk travelingnya naik mrt jakarta biar rasa singapore gituu wkwk
453,serunya naik mrt jakarta dengan lokasi strategis daerah perkantoran saya bisa sekalian cuci mata 
454,hari ini ke klien nyobain naik mrt lebih cepat hemat dan lebih sedikit panas panasan 
455,haha sorry gue rada kampung baru pertama naik mrt dan cuman kata amajiiinnnggg jujur bangga bgt sih 
456,lrt dan mrt merupakan salah satu transportasi kebanggaan masyrakat jakarta
457,bagi kami masyrakat jakarta lrt dan mrt adalah mahakarya
458,terwujudnya light rail transit lrt dan mass rapid transit mrt di jakarta sangat ditunggu oleh masyarakat 
459,akhirnya pagi tadi mencoba blok m lebak bulus lebak bulus senayan sangat bersih dan nyaman fasilitas juga lengkap 
460,dear mohon ibu yg duduknya santai banget ini ditegur dong ada petugas gtu yg patroli ini bkn jam sibuk petugas bisa keliling spt commuterline 
461,situasi stasiun bund hi kemarin sore kesan nyaman dan aman terasa banget 
462,nyamannya mrt jakarta
463,akhirnya berkesempatan untuk nyobain peradaban barunya jakarta alias mrt bersih nyaman dan cepat semoga rutenya bisa diekspansi ke berbagai penjuru jakarta sehingga semua masyarakat bisa punya akses yang setara untuk menikmati moda transportasi yang keren ini 
464,yang bikin loketnya tidak_efisien banget itu adalah kartunya diisi manual satu per satu sama petugasnya harusnya mereka bisa pake mesin kayak punyanya yang otomatis muntahin kartu dengan cepat jadi petugas tidak_perlu repot repot tap kartu satu di reader
465, di stasiun mrt dukuh atas kondisi bersih dan nyaman hanya masih kurang adanya tempat sampah 
466,sama ketika naik mrt di singapura sore ini coba naik mrt di jakarta nyaman aman dan tepat waktu
467,baru pulang ke jakarta liat mrt sama tiang mrt yang belom jadi kepikiran kalo proyek itu uangnya ngutang ngutang kok bangga
468,stasiun bundaran hi penuh sekali dan juga haus minum air putih aja sudah berasa di surga wkwkwk 
469,antrian panjang untuk membeli tiket petugas tidak_ramah stasiun bundaran hi 
470,udah lama di ibu kota tapi baru nyobain mrt terima kasih gubernur dan mantan mantan gubernur dki jakarta keretanya dingiiiiinnnn
471,baru kemarin sempet nyobain mrt nya jakarta wah bagus ya hehe berasa kaya lagi di luar negeri it s a good thing dan cuma ribu kemarin bolak balik istora blok a fatmawati mari di jaga bareng bareng ya fasilitas umum transportasi umum nya
472,kata siapa bahagia itu mahal senang melihat mereka senyum naik 
473,asyiknya berangkat kerja naik 
474,sekali naik mrt udah serasa di tokyo japan aja wkwk support your local transportation 
475,ada yang bisa tebak ini distasiun mana kalo yang sering naik transportasi umum terutama mrt pasti tau banget tidak_sengaja sambil lewat motret ternyata menarik jg seneng liat jakarta punya banyak tempat baru
476,halo di stasiun senayan escalator mati lift mati bagaimana cara saya yang cacat ini bisa naik ke permukaan 
477,senang rasanya ketika melihat bagian dari keluarga besar ikut senang dan bahagia walaupun hanya mengajak untuk naik begitu indah melihat senyuman ini
478,pak gub anak sy yg bungsu suka naik tentu sy harus dampingi jelaskan apa itu mrt fungsinya apa dan yg paling penting pengguna wajib tertib dan menjaga kebesihan 
479,pada percaya tidak_kalo tarif dalam sebulan itu hampir semahal tarif transportasi di helsinki misalnya naik mrt pp lebak bulus bundaran hi tiap hari dalam sebulan sekitar hari kerja x di helsinki zona tarif sebulan penuh
480,kalo liat stasiun mrt di china dalem banget jadi bersyukur kalo mrt di jakarta tidak_dalem bgt 
481,naik mrt jakarta biar ikutan kekinian di stasiun fatmawati paling atas tampias ujan sp masuk ke ruang tunggu jadi anak sy pake payung duduk di ruang tunggu keren jakarta sdh terwujud punya mrt semoga di rawat dengan baik jangan di rusak 
482,jujur tidak_kapok naik transportasi publik lg seharian pulang pergi naik mrt metrotrans pedestrian walk nya nyaman sekali hehe selalu suka jakarta bagian sini
483,berangkat lari biar tidak_macet naik bayar goceng menitan juga nyampe lah balik lari jalanan lengang naik transjakarta gratis dong cinta jakarta sangat 
484,naik krl mrt dan transjakarta keliling jakarta seharian puasss banget 
485,terima kasih saya tidak_pernah menyangka dari bendungan hilir atau karet menuju lebak bulus bisa ditempuh hanya dalam menit transjakarta s jalurnya padat merayap mulai dari pondok indah kalau naik mrt walau tidak_duduk tetap terasa nyaman 
486,replying to tolong dibuatkan sosialisasi mengenai pemakaian lift prioritas dong miris liatnya orang berjejalan antri naik lift malah yang harusnya membutuhkan lift jadi tidak_bisa pake
487, hari ini gw naik mrt kok ngerasa bau pesing ya alat pel nya mungkin tidak_bersih nih 
488,enjoy menikmati perjalanan naik krl bus tj dan mrt menelusuri utara hingga selatan jakarta sedikit lama tapi demi sebuah tulisan menikmatinya sambil berharap bertemu dengannya
489,kdg pengen ketawa ndiri naik lift di stasiun malah sering tidak_kebagian tmpt secara yg naik sehat dan tidak_hamil yg hamil malah nunggu lift nya kosong
490,dulu aja ke singapur sendiri pertama kalinya naik pesawat pertama kalinya ke luar negeri pertama kalinya naik mrt juga napa di jakarta yang jelas jelas di negara sendiri malah tidak_berani nyoba naik mrt sendirian
491,besok tidak_lagi deh naik memang juara lah
492,tau reaksi gue ketika barusan pertama kali naik mrt jakarta mewek saking terharu dan bangganya gue pernah nulis ini di buku ttg mendambakan mrt akhirnya kesampaian 
493,buat harga yaaa murah lah buat anak jakarta busyeng mulai rp an tidak_usah jauh ke jogja ini mah eh iya ini lokasinya di jalan h nawi tidak_jauh dari lampu merah itc fatmawati kalo naik turun di stasiun h nawi tinggal jalan dikit cocok deh buat city tour hehe
494,dari stasiun fatmawati kami kembali ke arah bund hi turun di stasiun senayan utk lanjut makan malam di fx tiket yg kami bayar utk jalan naik dr hi fatmawati senayan hanya ribu orang happy bgt menikmati mode transportasi canggih cepat murah bikin ceria
495,meski hujan deras tetap menikmati jakarta naik bersama keluarga 
496,beberapa hari yang lalu saya naik mrt di fatmawati nemuin tanda yang aneh macam gini uda saya cc ke akun mrtjakarta tapi tidak_ada yang respon apakah karena tidak_viral makanya tidak_direspon ya
497,naik mrt jakarta pertama kali sangat senang 
498,seru naik nyaman bersih dan cepat banget jarak antara stasiun bund hi ke stasiun lebak bulus hanya menit beneran bangga punya moda transportasi keren begini
499,hari ini saya ditegur karena menaiki gerbong depan yg dikhususnya untuk wanita waktu di luar jam yg dituliskam pie ini tipu 
500,ga bisa ngomong apa selain makasih bgt sama pak aldi dan kerja sama rekan keamanan sempat bertualang di stasiun fatmawati akhirnya dompetnya ketemu oh ya saya doain dedek bayinya sukses pak bravo 
501,mencoba untuk pertama kali so excited
502,my first time nyobain mrt alhamdulillah indonesia sudah mengembangkan infrastrukturnya sedikit demi sedikit semoga pemerintah berbondong untuk mengembangkan infrastruktur indonesia yang sangat berguna 
503, ini kemarin siang di halte plaza indonesia tidak_ada ptugas yg kliling apalagi negor sy langsung lapor ke satpam disitu tp cm iya aja tanpa follow through mana nih aturan denda nya perbanyak satpam yg kliling denda in mreka dong sdm dibekali capability jg 
504,hari ini mencoba nursery room nya stasiun mrt setiabudi astra wow tidak_nyangka ternyata bersih dan adem sekali terimakasih bisa memberikan fasilitas terbaik untuk ibu menyusui dan ibu yg mau ganti diapers anak
505, pantes kaya ada bau pesing salut buat para petugas yg sigap langsung bersihkan
506,min boleh kali yaa jadi perhatian petugas mrt khususnya di dukuh atas sering bgt lift prioritas itu digunakan bukan untuk semestinya
507, tdi mlm sekitar malam kurang d penumpang yang menempel di peron alih mengingatkan dngn sopan salah satu petugas dari jarak yg cukup jauh berteriak woiii memang penumpang tsb salah tapi saya rasa ada cara yg lbh sopan tks
508,petugas takut di tegur sm penumpang krn ada laki baru tau loh kl ada penumpang yg tidak_nyaman sm anak laki emang anak kecil laki bakal pedopil sm wanita dewasa aneh kreta khusus wanita itu bkn hny utk wanita anak wanita tp utk ibu dg anak 
509,staffnya mrt ini keren yak kapan ari nanya ke petugas security wcnya dimana dikasi arahan terus gua bilang terima kasih dia balesnya dengan senang hati sambil membungkuk dikit dan tangan di dada salut 
510, bisa info tidak_saya tanya ke petugas loket mrt mau top up jaklinggo ktnya gakbisa ditanya bisanya dimana malah jwb gaktau tidak_informatif pdhl kan saya beli kartu ini juga di stasiun mrt kalo blm ready mending jgn di jual dulu thanks
511,alhamdulillah sy sdah cb naik mrt nyaman dan petugas ramah bgt ksh ptunjuk i proud with trimakasih
512,pengalaman perdana naik mrt jakarta sore tadi bersih nyaman mesin kartu lancar orang orang di dalam gerbong tidak_urakan masih ada petugas jaga di dalam dan luar gerbong jadi lebih terasa aman tidak_paham sama kalian semua sing ngomal ngomel ae isok e 
513,salut sama petugas yg satu ini begitu antusias dan aktif memberi tahu dan mengkoreksi kelakuan penumpang lokasi stasiun cipete raya 
514,hari ini petugas di lebak bulus tegas abis semua yang tidak_ikutin aturan dibantai sama dia salut bapak
515,ac nya duingin pool perjalanan on time petugas security ama cleaning service nya juga ramah kayanya yg paling bagus view nya sta fatmawati tapi tidak_sempet kesitu tadi
516,abis nyoba mrt jakarta beberapa hari lalu dan jujur gua sangat amaze dengan mrt jakarta karena gara gara mrt jadi lumayan merubah wajah jakarta tidak_kalah kayak negara tetangga 
517,namanya stasiun mrt istora mandiri sponsornya mandiri tapi tidak_ada atm mandiri atau kcp buat isi ulang e money 
518,kepada dinas tata kota jakarta tersayang tolong dong pedestrian stasiun mrt istora senayan dikasih penghijauan jangan aspal aja hari ini panas sekali dan orang orang yang jalan disana sangat kepanasan karena tidak_ada yang melindungi mereka saat berjalan
519,di trotoar menuju stasiun fatmawati yang dari arah perempatan fatmawati udah seminggu terakhir lagi banyak banget ulat bulu udah berkurang sih semenjak pertama muncul kemarin banyak bgtbgt tapi tetep geli
520,malam min ac d stasiun senayan tidak_nyala ya kok panas tidak_dingin kayak biasanya brasa nunggu diluar tks
521,min tolong dibuatkan koridor atap ke park ride agar kalau hujan tetap bisa lewat yang kedua jalan dari park and rode ke stasiun lebak bulus suka bau pesing
522,perbandingan akses masuk ke stasiun bawah tanah empat mrt di asia tenggara akhirnya jakarta sejajar dengan singapura bangkok dan kuala lumpur 
523,udah sih gitu aja ceritanya bagus ternyata mrt jakarta nyaman aku bangga besok besok naik mrt lagi ah kalo ke mana mana 
524,enak bgt naik mrt jakarta cepet nyaman pula gapake macet macetan di jalan
525,mohon masalah aroma pesing di stasiun lebak bulus bisa segera diselesaikan semakin hari semakin menyengat dan membuat tidak_nyaman pejalan kaki
526,terima kasih mas petugas kebersihan yang masih aja nyikat lantai pk 
527,kesan pertama mencoba fasilitas mrt ibukota cukup memuaskan setara ketika saya berkunjung di singapore dan kualalumpur nyaman bersih pegawai ramah 
528,min kmren naik mrt suara masinisnya kurang keras kalah sama bising rel ktika otw plaza blok m senayan
529,kemaren gagal naik mrt di jakarta padahal sangat ingin
530,oke mungkin gue alay tp seneng bgt rasanya bisa naik mrt di jakarta loh bukan di luar negeri alhamdulillah ada kemajuan di negara ini 
531,hi kapan lift bisa digunakan di stasiun bundaran hi barusan melihat seorang pengguna kursi roda kesulitan karena harus naik eskalator terima kasih 
532,kantor di kemang biasanya paling males datang ke meeting di jakarta pusat tapi sejak ada naik dari stasiun cipete ke menteng cuma menit meeting jam total jam menit walaupun rush hour terimakasih eksekusi nyata 
533,pulang pergi naik di hari kerja menyenangkan lancar aman bersih sedikit antrean yang belum_beres perlahan budaya baru akan terbentuk yes ada infrastruktur publik digenjot presiden fr 
534,tadi sore utk kali kedua saya naik saya ajak sasha krn lg libur sekolah kali ini di mrt penuh bgt mgkn krn pas pulang kantor jg saya ikut rombongan pak diajak mba brg mas dkk makasih mbak ezki
535,efek naik mrt seminggu ini irit uang waktu tidur bisa lbh lama on time ngantor biasa seminggu sekali pasti telat adem dandan tuh tidak_luntur rambut tidak_bau matahari mood happy sesimple liat orang tertib badan seger pagi jalan kaki cinta bgt makasih 
536,hari ini sempat nyoba naik mrt dari fatmawati ke hi keren terima kasih pa dan gubernur yg lain juga 
537,dapat video ini dari anak saya yang sudah mencoba naik mrt selamat untuk semoga ini tidak_hanya menjadi moda transportasi massal yang bisa mengurangi kemacetan di jakarta saja tetapi bisa menjadi simbol peradaban baru demi indonesia yang jauh lebih baik maju
538,buat kalian pehobi bersepeda berikan kemudahan akses nih memperbolehkan sepeda lipat masuk ke dalam ratangga tunggu apalagi yuk naik transportasi umum 
539,menjajal mrt jakarta bersama gubernur dki kepala daerah sekitar jakarta dan warga saya naik dari stasiun bundaran hi turun di lebak bulus lalu kembali lagi hanya menit sekali jalan saya senang masyarakat antusias semoga begitu juga nanti setelah mrt beroperasi 
540,dengan bangga dan senang di jakarta hari udh naik krl transjakarta dan mrt
541,rapid apanya paling nunggu kedatangan mrt ya lama bisa sampai menit sama kayak mau naik busway nunggunya lama sampai menit
542,naik kalau bawa seli tidak_boleh duduk ya sekarang dari akhir ramadhan berdirinya disisi untuk orang dissabilitas 
543,temen yg bawa sepeda sekarang udah tidak_bisa duduk kalau naik mrt ini udah kesekian kalinya saya di usir dr tempat duduk dengan alasan yg bermacam 
544,naik mrt bau pesing yaallah mana rame bet lagi kaya ngantri sembako ngejubel semua di hi sama lebak bulus heran gua mah kirain jakarta sepi ternyata hmmm
545,jakarta sore ini asik banget buat jalan jalan sore ini survey lagi dg naik mrt n lanjut ke bbrp tempat cita pengen nyobain turun di setiap stasiun n liat suasana masing stasiun cuaca sore tidak_panas dan berangin lembut baru kali ini gw ngerasa bisa enjoy jkt 
546,min kenapa di loket mrt ngk bisa top up uang eletronik seperti flazz emoney dan sebagainya seperti tranjakarta kemaren kehabisan saldo terpaksa harus beli single trip dan naik mrt pun cuma sekali 
547,mencoba naik railink dan mrt hari ini takjub ternyata jakarta udah keren transportasi umumnya nyaman dan cepet yah salut
548, naik mrt sangat menguras emosi wajib tahan emosi beli tiket antrian panjang krn kurangnya loket tiket mau beli minum susah smoga kedepannya ada perbaikan khususny saat weekend sabtu minggu 
549,lebih mudah murah dan cepat keliling jakarta naik terimakasih bapak semoga di periode ini bisa lebih baik lagi membangun infrastruktur di negri kita indonesia ini
550,selama sy naik mrt blm pernah liat ada yg patroli sih
