,tweet
551,apakah aroma di dalam memang seperti ini saya naik mrt setiap hari dan selalu mendapati aroma seperti ini teman saya menyebutnya bau pesing saya tidak_terlalu setuju dengan itu meskipun itu memang bau yg paling mendekati 
552,mrt memudahkan pencapaian ke tempat tujuan mengurangi jumlah pengguna mobil motor meningkatkan jumlah pergerakan dan ekonomi kota serta meningkatkan kesehatan pengguna lumayan naik turun anak tangga di stasiun 
553,akhirnya hari ini nyobain mrt jakarta wkwk ketinggalan banget ya baru nyobain sekarang pertama kali naik mrt itu di singapore dan ternyata mrt jakarta sama bagusnya kok sama di singapore
554,anti macet macet club thank you cc pakde 
555,selalu bangga bgt setiap naik mrt and it still feels surreal everytime i ride on it feels like i m not in jakarta sebangga itu semoga bisa secepatnya nambahin rute di kota besar lainnya juga bs cepat menyusul
556,w naik mrt norakkkkkkk bangttt selain murah nyaman lucuuu trs kaget tbtb nyampe ayu dong bangun di grogol agar memudahkan ku ke kampus
557,halo saya baru aja bantu ibu dgn tongkat yang kesulitan karna tidak_di prioritaskan naik lift karena byk pnumpng umum yg pakai lift itu n cuek saya lapor satpam malah katanya gpp itu gimana ya tolong dong bantu kami masyarakat brusaha menyadarkan org g tertib
558,betul sangat ramah terhadap penyandang disabilitas sewaktu saya kecelakaan dan harus pake kruk naik mrt pergi dan pulang kantor sangat nyaman jempol untuk fasilitas pendukungnya
559,for the first time coba mrt dari pertama mulai beroperasi bener bener bantu bgt dari segi waktu fasilitas lainnya dan gaperlu macet macetan dari lebak bulus bundaran hi cuma mnt 
560,barusan lihat iklan kabar senat ada anggota dpr yg sidak fasilitas mrt di jakarta gan lihat dalamnya nyaman banget jakarta kelihatannya perlahan jg sdh mulai mengatasi masalah kemacetan gan salah satunya dg semakin banyak jenis fasilitas transportasi massal di jkt
561,antrian panjang tapi petugas loket cuma 
562, petugas security kalian tidak_pny cukup nyali utk menegur penumpang yg sdh terlihat jelas sdg makan di dlm mrt 
563, mohon bantuannya untuk menyediakan petugas di mesin tiket otomatis untuk stasiun bundaran hi banyak pengguna yg ingin isi ulang namun tidak_bisa dan tidak_ada petugas yg membantu sudah mengantri panjang dan sia sia 
564,menemukan sampah berserakan di bawah kursi tunggu lebak bulus grab kenapa security kemana petugas kebersihan kemana 
565,alhamdulillah sejak tiba di jakarta minggu lalu lgsg jajal naik moda transportasi massal ini nyaman n tentunya tepat waktu drpd pusing hadapi kemacetan dr lebak bulus grab mpe bundaran hi mending kita mrt ajah hehehe
566,seru sekali hari ini keliling kota jakarta naik mrt serasa turis daritadi norak bgt wkwk
567,yo udah berkali kali naik dari stasiun lebak bulus dan saya baru sadar tidak_ada tempat sampah di sekitar peron tanya sekuriti katanya di bawah saya kebawah tidak_ada juga mungkin diluar sebelum tap in akhirnya ke toilet nice one 
568,kenapa ya sampe sekarang kalo naik masih terkagum kagum dan berasa surreal jakarta punya mrt 
569,cobain mrt stasiunnya luas banget keretanya juga keren tidak_kalah sama singapore sayangnya bangkunya tidak_empuk kaya krl commuter mgkn krn dirancang utk perjalanan sejenak ya jd gausah empuk indonesia bisa bikin mrt juga ternyata selamat mrt keep up the good work
570,untuk anda yg suka on time silahkan gunakan untuk anda yg suka ngaret silahkan gunakan karena hal ini terpampang jelas perbedaan pelayanannya we ll see gue acara setengah di sentraya naik udh yang jam tp skrg msh di tebet
571,pengalaman pertama naik langsung bandingkan dengan di tokyo yg saat itu belum_sebulan dari tokyo luar biasa mrt jakarta saya pun naik pake kartu e toll yang selalu saya gunakan utk jalan toll malang surabaya semoga kedepan terintegrasi semua 
572, tolong keretanya lebih ontime lagi tertulis di jadwal brkt tapi pas jam di stasiun dan android time sudah berangkat on time bukan hanya tidak_terlambat tapi juga berangkat sesuai jadwal 
573,sudah pernah naik mrt jakarta enak lo adem 
574,gw berdoa semoga bisa menjangkau seluruh kawasan di jakarta biar gausah naik lagi dengan pelayanan terburuknya sepanjang masa mending yg sangaaaaat tepat waktu dengan fasilitas terbaik 
575,naik buat pertama kali jauh dari ciamis mumpung lagi d jakarta sangat nyaman bersih dan cepat tidak_kena macet ibukota naik dari stasiun lebak bulus grab berasa segerbong punya sendiri masih sangat pagi sih 
576,semuanya terukur dan tepat waktu warga berharap moda angkutan massal seperti ini diperpanjang sampai ke seluruh daerah di dki jakarta 
577, coba naik mrt tapi ssyang mushola di stasiun lebakbulus terlalu sempit dan pintu masuknya campur antara laki dan petempuan
578,pegawai juga ramah ramah murah senyum diajak ngobrol soal mrt juga nyambung dari office boy security sampai pegawai ticketing
579,bersih nyaman aman semoga makin bagus lagi fasilitasnya 
580,mumpung lagi di jakarta mau beli nasi goreng mrt lebak bulus yang rasanya tengku umar
581,min apakah nanti ada jalur mrt yang ke pasar minggu min 
582,hi min kartu flash apakah bisa digunakan untuk berdua atau satunya harus beli tiket manual 
583,aku pernah tinggal di dua tempat itu dan skrang menetap di bandung dari kondisi masyarakat kondisi cuaca enak di bandung jujur tapi soal fasilitas pelayanan pemerintah enak di jakarta menurut ku karena di bandung belum_ada mrt sama comuter line
584,baru ngeh juga tiket mrt hanya bs dibeli pake cash di ticket machine nya jg gada slot buat kartu sayang sekaliii dan di stasiun lebak bulus tidak_ada atm sama skali hiksu ini standar stasiun ya 
585, jkt mohon bantuannya untuk pedestrian dari park ride menuju lebak bulus grab mrt diperhatikan bau banget pak buu bau toilet 
586, escalator naik stasiun benhil exit jalan sudirman tiba mati banyak orang kaget pas udah ditengah escalator
587,pada prnh ke toilet pernah ke toilet yg ada bekas yg nga disiram nah persis baunya nih di jalur pejalan kaki samping depo
588,ada lajur antrian di tiap sisi seperti di jepang mungkin perlu dijelaskan cara antrinya pasang gambar aja biar nanti kalau penumpang mrt makin ramai antriannya terap tertib
589,mau naik mrt dari lebak bulus disitu ada untuk penitipan motor gk ya respon pls 
590,mulai ngerasa capek bolak balik mampang senen naik busway mau pindah naik mrt ongkosnya lebih mahal berkali lipat dan jalannya lebih muter naik krl mager desek an di krlnya tambah salut deh sama orang yg kerjanya pp jakarta bogor atau jakarta bekasi kuat bgt mereka
591,enak ye kalo pulang kerja naik mrt 
592,bagus nyaman murah bersih cepat twitter com bdl elzhex
593,gapernah bosen commuting naik bersih nyaman dan tepat waktu 
594,bahagia dan bangga menggukan moda bersih dan lancar tidak_kalah dg subway di new york dan washinton dc sekedar masukan ada baiknya petugas loket lebih ramah oknum mas petugasnya mungkin trainee kok agak ketus ya maju terus pic twitter com ferik eaox
595,meeting di daerah selatan di jam macet tidak_khawatir lg berkat 
596,pulang kantor mampir dulu apa langsung pulang thanks to perjalanan pulang sekarang jadi lebih cepat plus dapet foto keren pake galaxy a 
597,dan coba dilihat berapa banyak ojol di jakarta yg ternyata turut menyumbang kemacetan saya sih bukannya anti onjol tapi gregetan aja kalau ada yg protes jakarta macet tapi masih koar koar bangga leboh milih ojol daripada jalan kaki terus lanjut naik bus krl mrt
598,setiap lewat trotoar ini pejalan kaki harus siap menahan nafas sekitar menit tau kenapa karena bau pipis yg menyengat mungkin ya itu pipisnya para supir angkot dan bis coba sediain moving toilet di sini lokasi lebakbulus cc transjakarta 
599,dear kereta pertama menuju hi di gerbong pertama tetep ye bau nya tidak_enak aromanya tidak_fresh gitu kenapa yee 
600,tolong support payment via visa paywave juga dong
601,naik mrt memang nyaman tapi kenyamanan terganggu bila kita jalan menyusuri jalan dari dan ke parkiran lebak bulus grab menuju stasiun mrt bau pesing menyengat sepanjang jalan mohon atensi dari dan 
602,yang bikin jakarta macet itu ego kita gengsi kita saat bawa mobil dan kena macet gue ngeluh anjir gini amat ya macetnya saat naek krl atau mrt gue bersyukur busyet cepet amat ini enak bisa nyantai semua tergantung pilihan lu pakai transportasi apa 
603,aku setuju sama argumen ini sebagai user kendaraan umu tj harusnya sudah jadi solusi anti macet bahkan mendahui mrt dan lrt sayangnya tidak_dimanfaatkan secara maksimal o masyarakat makanya kesannya jakarta msg macet aja padahal simply krn orgnya ignorant maunya serba pribadi
604,dungu sekali cebong sampe tidak_bisa merasakan kemajuan tinggal di got melulu si mrt busway free jalan protokol yg lebih cantik liat bus sekolah free jakarta lbh manusiawi pedestrian yg aman ngapain belajar sama napi 
605, kuliner enak di sekitaran halte soto mie banjarsari rasanya mantap jam buka senin sabtu dari sampe habis sekiratan jam siang klo jam makan siang rame apalagi hari jumat 
606,liburan saya kamis bersama istri menikmati keindahan jakarta yang bersih dan indah rapih awal dari lenteng agung saya naik busway jurusan lebak bulus ui harga terjangkau orang di lebak bulus naik mrt jurusan hi senang bangga 
607,happy makin banyak yg bawa sepeda lipat naik artinya polusi jakarta makin berkurang
608,aga fasilitas yang ada dengan tidak_membuang sampah sembarangan dan tetap jaga kebersihan 
609,jadi lucu bisa pake kartu jenius di mrt singapore tapi di mrtjakarta belum_bisa 
610,halooo ini dari park n ride ke stasiun lb bulus grab kenapa bau pesing yaaaaa 
611,area jalan menuju halte mrt busway baunya pesing bgt tolong di monitor siapa kek gtu transjakarta jkt 
612,wc hanya satu di halte dan utk msk hrs bayar tap gate trans lalu lintas org di sekitar banyak sekali shgg koridor jd sasaran peturasan kenapa tidak_menyediakan wc umum di sekitar lokasi parkir biar bs digunakan mrk yg beranjak ke halte bus mrt 
613,efek petugas tidak_paham aturan soal gerbong wanita jadi harus diri dari hi sampe lebak bulus jangan hanya penumpang aja yg di edukasi petugas juga biar tidak_merugikan 
614,transportasi umum udh lengkap murmer nyaman kurang apa lgi coba 
615,dear pagi ini rute dukuh atas lebak bulus kereta nomor bau pesing pipis mungkin krn bau karbol pembersihnya mohon difollow up ya agar kedepannya tidak_terjadi lg sy pengguna harian mrt btw semangat 
616,musholla di bbrp stasiun terlalu kecil hanya bisa menampung orng saja 
617,biar tidak_bosen gitu ke bund hi pakai mrt mulu haha halte transjakarta bundaran hi in jakarta pusat dki jakarta 
618,kok suara mbak berubah sih 
619, min gerbong khusus wanita itu paling depan atau paling belakang sih skg kok yg laki di paling belakang pada diusir in semua 
620,yabedalah mbak walaupun kugaktau bedanya karena belum_pernah naik mrt 
621, twit jawab donk butuh klarifikasi ne
622, min pembelian kartu multi single trip itu apakah bisa di reimburse langsung cem krl apa gimana yak
623,iya mrt nya lucu
624,voice over mrt pagi ini agak beda lebih alus gitu tidak_teges kaya biasa tapi tetep suka 
625,kurangi antrean penumpang mrt jakarta tambah mesin tiket otomatis
626,dear boleh saran ditambah fasilitas atm di tiap halte dan atm di taro di sebelum pintu masuk jadi bisa isi emoney flazz atau tarik tunai untuk beli kartu single trip nya krn pengalaman saya tidak_jd naikmrt krn buru lupa tarik tunai dan gabisa isi emoney
627,naik mrt terus lanjut tj benar perwujudan ada harga ada rupa tetep sih dua duanya oke dan jakarta patut optimis karena selama ada kemauan maka permasalahan seberat sistem transport umum ruwet pun lama lama bisa selesai dengan baik dan dinikmati orang banyak kerja kerja kerja 
628,naik mempersingkat waktu tempuh pergi ke daerah jakarta selatan naik mempermudah pergi ke daerah kelapa gading naik transjakarta mempermudah akses ke seluruh penjuru jakarta dan sekitarnya 
629,haloooo kakak perkenalkan kami akun resmi warga jakarta yg peduli mrt jakarta jika ada info dr teman pengguna tentang kondii kegiatan ataupun update saat mengunakan mrt bs info kami yah terima kasih 
630,akun resmi warga jakarta yg peduli mrt jakarta 
631, sketsai biasanya di pojokan daerah priority seat tapi ada juga gerbong yang tidak_ada priority seatnya pesing di pojokan mungkin sejenis chemical yang dipakai gerbong 
632, sketsai cleaning solution right aku pernah tanya sama petugas bau mirip pesing ini bau cleaning solution yang dipakai 
633, hi min td sy naik mrt dari sta dukuh atas ke blok m beli tiket di loket kena tarif rb nah yg bikin sy bingung pulangnya dari blok m ke dukuh atas sy kena tarif rb kok beda yak emang tarif dg jarak yg sama bs beda gt mhn penjelasannya tkiuu
634,hmmm ini kadang mrt suka bau pesing aneh gitu ya aroma apakah ini 
635, transjakarta jkt akhirnya kencing di halte tirtayasa dan sama mengenaskan juga kondisi toiletnya dear transjakarta sepertinya kalian harus belajar banyak dari and also ganti lirik transportasi kelas dunia di jinggle kalian doesn t look good on ya 
636,appreciation tweet for karena satpamnya menegur ibu yg minum air mineral di kereta this means he really does his job goodlyyy wooow 
637, gw jg udah x pas ngetap keluar malah error disuruh ngetap lg malah saldo kesedot double saksi 
638, p gimana tidak_kzl ya uang aing rebu baliknya harusnya 
639, transjakarta kalo emang pengen orang beralih ke transportasi umum yang serius dong frekuensinya diperbanyak dan waktu operasinya diperpanjang jangan setengah setengah gini
640, keren banget animasinya menggemaskan dan menarik perhatian banget tapi juga padat informasi dan menjelaskan dengan baik salut untuk tim penyusun video ini 
641, transjakarta wah mantap dari blok m sekarang sudah bisa kemana saran aja min tolong diadakan feeder dari st bundaran hi langsung ke st gambir dan st senen sehingga tidak_perlu repot transit di halte monas cukup menyusahkan jika membawa barang banyak kalau transit
642,mau konfirmasi aja ke benarkah ada larangan untuk foto foto pribadi bukan komersial di dalam stasiun mrt kok saya tadi ditegur security 
643,bisa kali min bikin tiket bulanan tahunan dengan harga terjangkau biar makin banyak yg naik dan yg tiap hari naik jadi lebih hemat 
644,masinis nya mrt pagi ini mba mba cantik keren 
645,mantab mudah mudahan akan segera banyak jalur mrt di jakarta 
646, pagi min oo iya min napa di stasiun mrt senayan kok tidak_ada eskalator nya dan tidak_di buat yg keluar arah kemendikbud tq min 
647, biarpun sdh ada tertera peraturan nya tp tetap saja msh ada yg melanggar terkadang security jg tidak_mau memberi teguran mungkin takut penumpang tersinggung mrt the best deh pokoknya 
648,di lihat dr blueprint mrt banyak jalur yg akan di bangun tapi knapa tidak_ada yg lewat kawasan wisata spt ragunan dan tmii ragunan itu padat banget kl liburan membuat macet harusnya mrt ke sana 
649,terima kasih utk petugas kebersihan yg nyapa selamat malam padahal dia lg sibuk ngelap mesin tap di hilang sdh capek lembur 
650, agak kecewa soalnya jalan antara stasiun lebak bulus sama parkiran park ride bau pesing didiemin aja sama 
651, mrt phase dan lrt kapan selesainya ya kl pembangunan public transportationnya cepat selesai dan semua interconnected dgn baik kan warga jkt jg tidak_tllu mengandalkan kendaraan bermotor min 
652,ya allah musholla senayan kecil amat yak
653, mohon izin mau ngasih masukan saya perhatikan di stasiun istora yang masuknya dari polda itu standar pengecekan di securitynya berubah ubah kadang ada yang jaga kadang tidak_kadang dipindai kadang tidak_apa tidak_sebaiknya dibikin standar ya sop nya 
654,musala di stasiun lebak bulus sempit banget 
655, ini pegawai mrt bisa dipastikan semuanya naik kendaraan umum ke kantor 
656,baru naik dari senayan eh tahu sdh sampai hi keren
657,berharap suatu saat nanti halte transjakarta lebih nyaman seperti stasiun 
658, tadi malam saya naik mrt dr lb bulus grab tercium aroma pesing di gerbongnya kirain hanya di trotoar yg nuju lampu merah ps jumat aja yg bau ada bbrp bagian trotoarnya itu yg gelap tolong ditambahin lampu ya 
659,baru ngeh juga tiket mrt hanya bs dibeli pake cash di ticket machine nya jg gada slot buat kartu sayang sekaliii dan di stasiun lebak bulus tidak_ada atm sama skali hiksu ini standar stasiun ya 
660, jkt mohon bantuannya untuk pedestrian dari park ride menuju lebak bulus grab mrt diperhatikan bau banget pak buu bau toilet 
661, escalator naik stasiun benhil exit jalan sudirman tiba mati banyak orang kaget pas udah ditengah escalator
662, ada lajur antrian di tiap sisi seperti di jepang mungkin perlu dijelaskan cara antrinya pasang gambar aja biar nanti kalau penumpang mrt makin ramai antriannya terap tertib
663,beruntung banget bisa punya fasilitas kayak mrt di jakarta tidak_sabar rute tangsel selesai cc 
664,pagi masa tidak_ada improve nya sih dgn keterlambatan commuter line coba dong contoh yg sdh ontime apalagi yg rute ke bekasi sudah double double track loh dr jatibegara ke cakung masa tidak_adjust waktu tempuhnya apa ada yg slh dgn sistem personalnya 
665, ini masak tiap mo nasuk stasiun berhenti mulu sik min lebih lama lg dr biasanya kok tidak_bener jg sih minn andai deket rumah udh mending naik itu dahh
666,kuturun cipete emang cuma buat pagi sore sih terimakasih telah mempererat persaudaraanku dengan pagi sore 
667,ayo aku dukung untuk memperluas jangkauannya hingga wilayah wilayah suburban supaya pelayanan transportasi publik bisa lebih menghargai waktu dan tenaga kelas pekerja 
668,sudah dua hari berturut turut naik mrt yang kinclong sampai ke kolong salut keep it up 
669, asiiik berarti pake kartu bca flazz yg biasa dipake utk busway udah bisa di pake utk mrt kan min 
670,gimana ni masa di luar negri bisa disini gabisa 
671, keterlaluan yang bener bukan tidak_boleh minum tapi jangan buang sampah sembarangan org kemarin byk hbs lari pd minum security tai
672,entah apa hidungku yg salah kok kabin spt bau pesing ya 
673, dan saya denger setiap kesalahan gaji mereka dipotong miris saya mah apakah setiap mereka berbuat kebenaran gaji mereka akan dinaikin tolong jawab 
674, kenapa deee pengumuman dalam keretanya gede bangettt pengumumannya udh kayak tereakin penumpang 
675,udah seneng tadinya denger info kalo kartu paywave contactless card bisa dipake di mrt taunya tidak_jadi seneng kalo itu di baru bisa dipake mrt sg jadi kapan ini bisa pake contactless paywave nya visa sayang banget teknologinya
676,dear kereta pertama menuju hi di gerbong pertama tetep ye bau nya tidak_enak aromanya tidak_fresh gitu kenapa yee 
677,alangkah nyaman nya kalo di stasiun mrt ada atm dari bank yg e wallet nya bisa buat bayar tiket 
678, atap pun tak ada ntar musim hujan bakal repot
679, transjakarta kalo turun di stasiun mrt fatmawati trus nyambung d ke cinere dengan harga ribu sepertinya kemahalan ya
680, iya kaya bau pesing gitu tiap pagi sama kereta sore ke malam juga bau kenapa ya admin 
681, sering kali memang baunya tidak_segar kayak bau basi mungkin kualitas air atau penggunaan berkali tanpa penggantian baik buat lantai dan bagian lain
682, saya pengguna reguler dihampir semua jadwal dan baunya selalu bau basi jadi bukan sekali dua kali
683, transjakarta itu akibat cari toilet susah sekali ada toilet susah parkirnya 
684,adakah pengguna yg lain yg merasa kalo bau di rangkaian mrt seperti bau pesing ato cuma saya aja ya yg hidungnya terlalu sensitif ntah kenapa saya merasa bau nya kurang sedap ntah bau karbolnya atau apa gitu saya kurang tau juga menurut pendapat saya ya
685,naik moda transportasi modern keren deh pokok nya 
686, tolong disediakan atm dong di stasiun susah bgt niy mau narik uang cash 
687, barusan di gerbong ada bekas pipis nih bau tp y gt karna pas di lebak bulus g di cek up kebersihannya dulu jd ada orang yg g sengaja duduk dsitu akhirnya pdhl aq dah bilangin awas basah tolong dong dibersihin
688, saya gtw itu tiap hari atau tidak_makanya saya minta klarifikasi dari kalau memang sop nya seperti itu saya terima dan saya naik moda transportasi lain yang saya tekankan itu saya minta klarifikasi bukan cari kesalahan orang lain 
689, saya juga merasakan hal yang sama mas kemarin ketika naik dari stasiun dukuh atas bni ke stasiun istora mandiri pun mrt dr arah sebaliknya saya kira awalnya ada toilet di dalam rangkaian mrt tapi mungkin aroma dari pengaharumnya kali ya
690, naik angkutan umum yuk pak bukan ojeg dan taxi online terus jalan kaki nikmati panas hujan dan polusi asyik rame dan seru naik angkot transjakarta segera menyusul ada kurangi menggunakan kendaraan pribadi mobil motor 
691, semenjak ada dirimu dunia terasa indahnya 
692, id hai mimin family mart mrt benhil acnya tidak_nyala nih sumpek banget di dalem mohon diperbaiki ya
693, ontime pake banget naek mrt 
694, ada baiknya himbauan tidak_mengangkat menelpon saat di dalam mrt dilakukan pa nya saja sdh berisik kalau ada penumoang spt bapak yg direkaman diatas akan jadi polusi suara sangat tidak_nyaman 
695, ini gerbong mrt pertama untuk k kok seperti bau pesing ya bisa dibantu untuk pengecekannya saat ini memasuki istora mandiri thx
696, sore ini di stasiun istora mandiri ada kejadian yang sama pengendara sepeda lipat minum air di peron tanpa rasa bersalah peraturan dibuat agar dilecehkan 
697, ruwet begini hampir setiap hari di bawah st mrt fatmawati apakah lahan mangkrak eks showroom sebelah bpjs tk tidak_bisa dibuka khusus untuk lokasi penjemputan taksol ojol penumpang jd tidak_di p an di stasiun lain selalu ada jalur cerukan kec fatmawati pdhl ramai jemputan 
698,tiap hari rutin naik pnasaran sama promo fore coffee idr dg tunjukkan tiket single trip struk pmbelian isi ulang promonya benar ada dpt redeem gift voucher di apps fore coffee mantul sering adain promo loyalty bgini biar makin rajin naik mrt 
699, transjakarta ini rute dari tempat parkir ke stasiun mrt lebak bulus memang bau pesingnya parah sekali mungki krn disitu tempat ngetem angkot juga lebih baik sediakan toilet umum saja buat para sopir angkot itu 
700,kondisi mrt sepi dan kosong tidak_ada yg berdiri maupun terganggu posisi helm saya gantungkan d depan saya 
701, cuma kepikiran aja sih cuma ini kan di indonesia ya alangkah baiknya kalau petunjuk arah atau signage nya dibuat ada yg bahasa indonesia jg misal di lift sbg bentuk kecintaan thd bahasa indonesia cuma kepikiran aja kok tp 
702, id sy sudah daftar dr hari kamis minggu lalu sampai skrg tidak_ada balasan email atau apapun jadinya gmn ya acara ini 
703, memang baunya sangat menyengat dan membuat sesak napas
704,yaa rabb enak bat ngerasain tugu tani ke lebak bulus jam transjakarta 
705, ternyata penumpang minum di peron mrt lebak bulus tidak_apa aturan hanya untuk di langgar penumpang tersebut tidak_kena denda rupiah
706, aku suka naik angkutan umum sayangnya karena tempatku skrg dipinggir jakarta jadi hrs ganti angkutan beberapa kali yang paling tidak_nyaman ya naik angkot yg pengemudinya sering kali ugal an dijalan paling nyaman pakai transjakarta dan 
707,bodoh sih kalo komplein ttg bau pesing tapi yg dibersihkan hanya sampah fisik pak mohon sangat utk dibantu masih daerah rumah bapak jg baunya sdh sangat sangat menggangu pejalan kaki sudah sejak bln komplain 
708, baru tadi nyobain mrt ternyata indah juga semangaaaat buat para petugasnya yaa 
709, akhirnya tadi pagi tidak_ambil tiket karena mesin parkir tidak_bs kebuka petugas parkirpun tidak_ada di lokasi 
710, terima kasih hanya update sampai hari ini masih belum_ada progress sepanjang pedestrian dari park and ride sampai masuk ke lebakbulus grab aromanya sangat tidak_nyaman terimakasih
711, kalo rencana diperpanjang sampe bsd direalisasikan makin mantap
712, sekalian ditambah park n ridenya satu lagi card reader bisa dipercepat tidak_waktunya utk tap in out td nyoba pake flazz agak lama ya itu aja point hasil review tadi thanks 
713,baru sempet nyoba mrt hari ini overall mantep lah sesuai ekspektasi sebuah metro mass rapid tapi ada bbrp minor yg perlu ditambah diperbaiki 
714, pas beli tiket juga di mbak loket dia mesin yg nge write rfid kartunya lama itu gue rasa algoritma mesinnya aja yg beribet deh jadi tidak_efisien atau servernya yg kurang bagus jadi ngeproses datanya lama 
715,gate in masih belum_bagus ya sudah tap in atau belum_kadang tidak_jelas 
716,katanya millenials anak gaul jakarta tp nunggu yg turun dulu pas naik mrt aja tidak_tau mon maap tidak_tahan buat nyiyir 
717,enaknya punya kantor dekat stasiun mrt kamu bisa lari di gbk dengan akses yang cepat dan mudah dari intiland tower jakarta kamu tinggal naik mrt dari stasiun benhil yang berada persis di depan gedung lalu turun di stasiun istora 
718,naik mrt jam segi ini enak banget dari fatmawati sampai halte asean bisa liat langit sore jakarta
719,intip keseruan para pemain gundala naik mrt jakarta 
720,ku kalo maen ke jakarta juga lebih sering naik transportasi umum lebih praktis motor tinggal dititipin di stasiun pergi naik krl ntar bisa sambung pake busway ato tidak_mrt cepet nyaman dan murah 
721,nikmat nya naik mrt lalu jalan km menuju tempat meeting sehat bener ya tuntaskan langkah hari ini 
722,anda warga selatan jakarta yg kelewatan mrt nda mau naik mrt aja ta bagus begini sepi amaattt 
723,pertama kali naik mrt jakarta mau tau saja yang katanya orang orang mrt jakarta itu keren banget kaya yang di jepang singapore dll saya naik nya dari mrt bundaran hi station di 
724,yuk mari dukung kurangi polusi jakarta dengan naik kendaraan umum kendaraan umum juga nyaman krl mrt lrt brt 
725,tiap naik mrt selalu ada yang cakep hem apakah ini kualitas kota administratif jakarta selatan 
726, inget nder jakarta udah makin polusi ngadatenya naik mrt aja
727,sebenernya sih udah banyak banget jakartans yang pake public transportation setiap naik mrt juga bukannya sepi rame rame aja krl sama tj pun sama jadi kadang penasaran aja sebanyak apa sih orang yang tinggal di jakarta sepadat itu ya sampe jalanan masih aja penuh 
